{
  "script_id": "01001007",
  "title": "桑园寄子",
  "plot_stages": [
    {
      "stage": "铺垫",
      "label": "引入·唱抒",
      "block_range": [
        0,
        67
      ],
      "summary": "祭礼、伯俭、丧命、撇下、备定（以念为主 55%）"
    },
    {
      "stage": "发展",
      "label": "推进·唱抒",
      "block_range": [
        68,
        122
      ],
      "summary": "黑水、收拾、家丁、不言、不语（以念为主 58%）"
    },
    {
      "stage": "冲突",
      "label": "对峙·唱抒",
      "block_range": [
        123,
        177
      ],
      "summary": "邓方同、贼兵、众人、一家人、望见（以念为主 58%）"
    },
    {
      "stage": "高潮",
      "label": "激战·低谷",
      "block_range": [
        178,
        238
      ],
      "summary": "贼兵、杀死、啼哭、哥哥、行走（以念为主 69%）"
    },
    {
      "stage": "结局",
      "label": "收束·唱抒",
      "block_range": [
        239,
        307
      ],
      "summary": "侄儿、血书、婶母、珠泪、哥哥（以念为主 58%）"
    }
  ],
  "rhythm_series": [
    {
      "block_index": 0,
      "window": 20,
      "dialogue_density": 0.5455,
      "aria_ratio": 0.0,
      "action_intensity": 0.3636,
      "emotion_score": 0.75,
      "tension_score": 0.2273
    },
    {
      "block_index": 12,
      "window": 20,
      "dialogue_density": 0.5833,
      "aria_ratio": 0.0,
      "action_intensity": 0.3333,
      "emotion_score": 0.75,
      "tension_score": 0.225
    },
    {
      "block_index": 13,
      "window": 20,
      "dialogue_density": 0.6154,
      "aria_ratio": 0.0,
      "action_intensity": 0.3077,
      "emotion_score": 0.75,
      "tension_score": 0.2154
    },
    {
      "block_index": 14,
      "window": 20,
      "dialogue_density": 0.6429,
      "aria_ratio": 0.0,
      "action_intensity": 0.2857,
      "emotion_score": 0.78,
      "tension_score": 0.2263
    },
    {
      "block_index": 15,
      "window": 20,
      "dialogue_density": 0.6667,
      "aria_ratio": 0.0,
      "action_intensity": 0.2667,
      "emotion_score": 0.78,
      "tension_score": 0.2187
    },
    {
      "block_index": 16,
      "window": 20,
      "dialogue_density": 0.6875,
      "aria_ratio": 0.0,
      "action_intensity": 0.25,
      "emotion_score": 0.78,
      "tension_score": 0.212
    },
    {
      "block_index": 17,
      "window": 20,
      "dialogue_density": 0.7059,
      "aria_ratio": 0.0,
      "action_intensity": 0.2353,
      "emotion_score": 0.78,
      "tension_score": 0.2395
    },
    {
      "block_index": 20,
      "window": 20,
      "dialogue_density": 0.7222,
      "aria_ratio": 0.0,
      "action_intensity": 0.2222,
      "emotion_score": 0.78,
      "tension_score": 0.2342
    },
    {
      "block_index": 21,
      "window": 20,
      "dialogue_density": 0.7368,
      "aria_ratio": 0.0,
      "action_intensity": 0.2105,
      "emotion_score": 0.78,
      "tension_score": 0.2295
    },
    {
      "block_index": 22,
      "window": 20,
      "dialogue_density": 0.75,
      "aria_ratio": 0.0,
      "action_intensity": 0.2,
      "emotion_score": 0.78,
      "tension_score": 0.2253
    },
    {
      "block_index": 23,
      "window": 20,
      "dialogue_density": 0.7619,
      "aria_ratio": 0.0,
      "action_intensity": 0.1905,
      "emotion_score": 0.78,
      "tension_score": 0.2215
    },
    {
      "block_index": 24,
      "window": 20,
      "dialogue_density": 0.8095,
      "aria_ratio": 0.0,
      "action_intensity": 0.1429,
      "emotion_score": 0.78,
      "tension_score": 0.2072
    },
    {
      "block_index": 25,
      "window": 20,
      "dialogue_density": 0.8571,
      "aria_ratio": 0.0,
      "action_intensity": 0.1429,
      "emotion_score": 0.78,
      "tension_score": 0.2072
    },
    {
      "block_index": 26,
      "window": 20,
      "dialogue_density": 0.8571,
      "aria_ratio": 0.0,
      "action_intensity": 0.1429,
      "emotion_score": 0.78,
      "tension_score": 0.2072
    },
    {
      "block_index": 28,
      "window": 20,
      "dialogue_density": 0.8571,
      "aria_ratio": 0.0,
      "action_intensity": 0.1429,
      "emotion_score": 0.5933,
      "tension_score": 0.1659
    },
    {
      "block_index": 29,
      "window": 20,
      "dialogue_density": 0.8095,
      "aria_ratio": 0.0476,
      "action_intensity": 0.1429,
      "emotion_score": 0.5,
      "tension_score": 0.1286
    },
    {
      "block_index": 31,
      "window": 20,
      "dialogue_density": 0.8095,
      "aria_ratio": 0.0952,
      "action_intensity": 0.0952,
      "emotion_score": 0.58,
      "tension_score": 0.1463
    },
    {
      "block_index": 32,
      "window": 20,
      "dialogue_density": 0.7619,
      "aria_ratio": 0.1429,
      "action_intensity": 0.0952,
      "emotion_score": 0.4429,
      "tension_score": 0.1371
    },
    {
      "block_index": 34,
      "window": 20,
      "dialogue_density": 0.7143,
      "aria_ratio": 0.1905,
      "action_intensity": 0.0952,
      "emotion_score": 0.4429,
      "tension_score": 0.1371
    },
    {
      "block_index": 35,
      "window": 20,
      "dialogue_density": 0.7143,
      "aria_ratio": 0.1905,
      "action_intensity": 0.0952,
      "emotion_score": 0.4429,
      "tension_score": 0.1371
    },
    {
      "block_index": 36,
      "window": 20,
      "dialogue_density": 0.7143,
      "aria_ratio": 0.1905,
      "action_intensity": 0.0952,
      "emotion_score": 0.4429,
      "tension_score": 0.1371
    },
    {
      "block_index": 37,
      "window": 20,
      "dialogue_density": 0.7143,
      "aria_ratio": 0.1905,
      "action_intensity": 0.0952,
      "emotion_score": 0.4429,
      "tension_score": 0.1371
    },
    {
      "block_index": 38,
      "window": 20,
      "dialogue_density": 0.7143,
      "aria_ratio": 0.1905,
      "action_intensity": 0.0952,
      "emotion_score": 0.4,
      "tension_score": 0.1876
    },
    {
      "block_index": 39,
      "window": 20,
      "dialogue_density": 0.7143,
      "aria_ratio": 0.1905,
      "action_intensity": 0.0952,
      "emotion_score": 0.4,
      "tension_score": 0.1829
    },
    {
      "block_index": 40,
      "window": 20,
      "dialogue_density": 0.7143,
      "aria_ratio": 0.1905,
      "action_intensity": 0.0952,
      "emotion_score": 0.3,
      "tension_score": 0.3229
    },
    {
      "block_index": 41,
      "window": 20,
      "dialogue_density": 0.6667,
      "aria_ratio": 0.2381,
      "action_intensity": 0.0952,
      "emotion_score": 0.3,
      "tension_score": 0.3229
    },
    {
      "block_index": 42,
      "window": 20,
      "dialogue_density": 0.6667,
      "aria_ratio": 0.2381,
      "action_intensity": 0.0952,
      "emotion_score": 0.2778,
      "tension_score": 0.3317
    },
    {
      "block_index": 43,
      "window": 20,
      "dialogue_density": 0.6667,
      "aria_ratio": 0.2381,
      "action_intensity": 0.0952,
      "emotion_score": 0.34,
      "tension_score": 0.3069
    },
    {
      "block_index": 44,
      "window": 20,
      "dialogue_density": 0.619,
      "aria_ratio": 0.2857,
      "action_intensity": 0.0952,
      "emotion_score": 0.4333,
      "tension_score": 0.2695
    },
    {
      "block_index": 45,
      "window": 20,
      "dialogue_density": 0.5714,
      "aria_ratio": 0.3333,
      "action_intensity": 0.0952,
      "emotion_score": 0.4333,
      "tension_score": 0.2648
    },
    {
      "block_index": 46,
      "window": 20,
      "dialogue_density": 0.5238,
      "aria_ratio": 0.381,
      "action_intensity": 0.0952,
      "emotion_score": 0.4429,
      "tension_score": 0.261
    },
    {
      "block_index": 47,
      "window": 20,
      "dialogue_density": 0.4762,
      "aria_ratio": 0.4286,
      "action_intensity": 0.0952,
      "emotion_score": 0.4429,
      "tension_score": 0.261
    },
    {
      "block_index": 48,
      "window": 20,
      "dialogue_density": 0.4762,
      "aria_ratio": 0.4286,
      "action_intensity": 0.0952,
      "emotion_score": 0.4429,
      "tension_score": 0.2657
    },
    {
      "block_index": 49,
      "window": 20,
      "dialogue_density": 0.4286,
      "aria_ratio": 0.4762,
      "action_intensity": 0.0952,
      "emotion_score": 0.42,
      "tension_score": 0.2749
    },
    {
      "block_index": 50,
      "window": 20,
      "dialogue_density": 0.4286,
      "aria_ratio": 0.5238,
      "action_intensity": 0.0476,
      "emotion_score": 0.42,
      "tension_score": 0.2606
    },
    {
      "block_index": 51,
      "window": 20,
      "dialogue_density": 0.381,
      "aria_ratio": 0.5714,
      "action_intensity": 0.0476,
      "emotion_score": 0.4765,
      "tension_score": 0.238
    },
    {
      "block_index": 52,
      "window": 20,
      "dialogue_density": 0.381,
      "aria_ratio": 0.5714,
      "action_intensity": 0.0476,
      "emotion_score": 0.4765,
      "tension_score": 0.238
    },
    {
      "block_index": 53,
      "window": 20,
      "dialogue_density": 0.4286,
      "aria_ratio": 0.5238,
      "action_intensity": 0.0476,
      "emotion_score": 0.4294,
      "tension_score": 0.2616
    },
    {
      "block_index": 54,
      "window": 20,
      "dialogue_density": 0.4286,
      "aria_ratio": 0.5238,
      "action_intensity": 0.0476,
      "emotion_score": 0.45,
      "tension_score": 0.2533
    },
    {
      "block_index": 55,
      "window": 20,
      "dialogue_density": 0.4762,
      "aria_ratio": 0.4762,
      "action_intensity": 0.0476,
      "emotion_score": 0.4294,
      "tension_score": 0.2616
    },
    {
      "block_index": 56,
      "window": 20,
      "dialogue_density": 0.4286,
      "aria_ratio": 0.5238,
      "action_intensity": 0.0476,
      "emotion_score": 0.4294,
      "tension_score": 0.2568
    },
    {
      "block_index": 57,
      "window": 20,
      "dialogue_density": 0.381,
      "aria_ratio": 0.5714,
      "action_intensity": 0.0476,
      "emotion_score": 0.46,
      "tension_score": 0.2446
    },
    {
      "block_index": 58,
      "window": 20,
      "dialogue_density": 0.381,
      "aria_ratio": 0.619,
      "action_intensity": 0.0,
      "emotion_score": 0.46,
      "tension_score": 0.2303